{
  "schema_version": "2.0",
  "scope": "GENERALIZED_COMPETITIVE_CONTRAST_SEED_PACK",
  "pack_id": "QGEN_FRESH_HOLDOUT_24_WAVE_1_SEEDS",
  "pack_version": "1.0.0",
  "parent_pack_id": null,
  "creation_scope": "FRESH_HOLDOUT_BOUNDED_ONE_WAVE_SEED_ACQUISITION",
  "opportunity_scope": [
    "LD-H24-A25",
    "LD-H24-P003",
    "LD-H24-GY40",
    "LD-H24-GS73",
    "LD-H24-OR57",
    "LD-H24-PS04",
    "LD-H24-PH09"
  ],
  "study_unit_scope": [
    "SU-A-25",
    "SU-P-003",
    "SU-GY-40",
    "SU-GS-73",
    "SU-OR-57",
    "SU-PS-04",
    "SU-PH-09"
  ],
  "input_hashes": {
    "opportunities": "6b352c3d377e272fc2c5def60fbf659bc6e6bc01ace0dbb64882e00c2daff805",
    "feature_maps": "1399e5e76360cc48bf8a616d479b71f96c78aa71b60fcb12eeb9ebbfbd630448"
  },
  "review_hashes": {
    "independent_seed_review": "61430e0e71271da9e0cdd7fc7f879159903d52e8d7b1fa8727b0a5edfc4d8c27"
  },
  "frozen": true,
  "targets": [
    {
      "target_id": "LD-H24-A25",
      "discipline": "MEDICINE",
      "anchor_study_unit_id": "SU-A-25",
      "learner_decision_id": "LD-H24-A25",
      "seeds": [
        {
          "seed_id": "SEED-H24-FA8063C3A9C42B7E",
          "competitor_concept_id": "CONCEPT-H24-FA8063C3A9C42B7E",
          "competitor_concept": "Vasovagal reaction",
          "preferred_label": "Vasovagal reaction",
          "competitor_study_unit_id": "SU-A-25",
          "discipline": "MEDICINE",
          "learner_decision_id": "LD-H24-A25",
          "response_class": "PLAUSIBLE_DIAGNOSTIC_ENTITY",
          "competitor_semantic_category": "PLAUSIBLE_DIAGNOSTIC_ENTITY",
          "competitor_decision_granularity": "DIAGNOSIS",
          "option_set_archetype": "DIAGNOSIS_SET",
          "candidate_classification": "COUNTERFACTUAL_CORRECT",
          "relation_ids": [
            "CCR2-H24-FA8063C3A9C42B7E"
          ],
          "anchor_relation_ids": [
            "AR-H24-FA8063C3A9C42B7E"
          ],
          "why_plausible_for_this_decision": "SF-H24-A25-01 is a positive shared-decision anchor.",
          "conditions_under_which_competitor_would_be_correct": "Pallor, bradycardia, and hypotension after a needle stimulus without the characteristic neurologic prodrome.",
          "shared_features_with_key": [
            "SF-H24-A25-01"
          ],
          "candidate_visible_discriminators": [],
          "why_a_partially_knowledgeable_candidate_might_choose_it": "It is a legitimate same-decision alternative in a nearby clinical context.",
          "evidence_refs_for_plausibility": [
            "H24-SEED-MED-LAST-DIFFERENTIAL-01"
          ],
          "evidence_refs_for_discrimination": [
            "H24-SEED-MED-LAST-DIFFERENTIAL-01"
          ],
          "evidence_refs": [
            "H24-SEED-MED-LAST-DIFFERENTIAL-01"
          ],
          "requires_terminal_exclusion_clue": false,
          "strength": "STRONG",
          "onboarding_status": "APPROVED",
          "author_provenance": {
            "author_id": "root-fresh-holdout-author-2026-09-07",
            "proposal_id": "SP-H24-FA8063C3A9C42B7E",
            "candidate_input_sha256": "e1030f7d1e69255ae778041959942e482d99bafce080f44d67f67fd27d5dedbd"
          },
          "independent_seed_review": {
            "verdict": "APPROVED",
            "review_sha256": "06d13a117bd598f90eed42bd9d567748d69bc5f78550ea74831840c1dcec2882",
            "learner_decision_compatibility": "PASS",
            "response_class_compatibility": "PASS",
            "granularity_compatibility": "PASS",
            "positive_plausibility_support": "PASS",
            "inferior_to_key": "PASS",
            "anchor_positive_for_candidate": "PASS",
            "second_key_safety": "PASS",
            "scope_safety": "PASS",
            "comment": "The cited shared feature positively anchors the candidate, while the frozen stem lacks the stated condition required to make it correct.",
            "reviewed_strength": "STRONG"
          },
          "retrieval_scope": {
            "scope_type": "STUDY_UNIT",
            "study_unit_ids": [
              "SU-A-25"
            ],
            "learner_decision_ids": [
              "LD-H24-A25"
            ]
          }
        },
        {
          "seed_id": "SEED-H24-5CC9D8BA9164AC10",
          "competitor_concept_id": "CONCEPT-H24-5CC9D8BA9164AC10",
          "competitor_concept": "Panic-related hyperventilation",
          "preferred_label": "Panic-related hyperventilation",
          "competitor_study_unit_id": "SU-A-25",
          "discipline": "MEDICINE",
          "learner_decision_id": "LD-H24-A25",
          "response_class": "PLAUSIBLE_DIAGNOSTIC_ENTITY",
          "competitor_semantic_category": "PLAUSIBLE_DIAGNOSTIC_ENTITY",
          "competitor_decision_granularity": "DIAGNOSIS",
          "option_set_archetype": "DIAGNOSIS_SET",
          "candidate_classification": "COUNTERFACTUAL_CORRECT",
          "relation_ids": [
            "CCR2-H24-5CC9D8BA9164AC10"
          ],
          "anchor_relation_ids": [
            "AR-H24-5CC9D8BA9164AC10"
          ],
          "why_plausible_for_this_decision": "SF-H24-A25-03 is a positive shared-decision anchor.",
          "conditions_under_which_competitor_would_be_correct": "Prominent tachypnea and anxiety with paresthesias, without a toxic temporal dose relationship.",
          "shared_features_with_key": [
            "SF-H24-A25-03"
          ],
          "candidate_visible_discriminators": [],
          "why_a_partially_knowledgeable_candidate_might_choose_it": "It is a legitimate same-decision alternative in a nearby clinical context.",
          "evidence_refs_for_plausibility": [
            "H24-SEED-MED-LAST-DIFFERENTIAL-01"
          ],
          "evidence_refs_for_discrimination": [
            "H24-SEED-MED-LAST-DIFFERENTIAL-01"
          ],
          "evidence_refs": [
            "H24-SEED-MED-LAST-DIFFERENTIAL-01"
          ],
          "requires_terminal_exclusion_clue": false,
          "strength": "STRONG",
          "onboarding_status": "APPROVED",
          "author_provenance": {
            "author_id": "root-fresh-holdout-author-2026-09-07",
            "proposal_id": "SP-H24-5CC9D8BA9164AC10",
            "candidate_input_sha256": "2655dba19064e8de8282ffe35d792d8f1584ba08926653a81533ab6ab042263b"
          },
          "independent_seed_review": {
            "verdict": "APPROVED",
            "review_sha256": "603320f22323eac52dc2cffeb6f3cd1cfa7b6c10e32564df35d16dbbbee1759b",
            "learner_decision_compatibility": "PASS",
            "response_class_compatibility": "PASS",
            "granularity_compatibility": "PASS",
            "positive_plausibility_support": "PASS",
            "inferior_to_key": "PASS",
            "anchor_positive_for_candidate": "PASS",
            "second_key_safety": "PASS",
            "scope_safety": "PASS",
            "comment": "The cited shared feature positively anchors the candidate, while the frozen stem lacks the stated condition required to make it correct.",
            "reviewed_strength": "STRONG"
          },
          "retrieval_scope": {
            "scope_type": "STUDY_UNIT",
            "study_unit_ids": [
              "SU-A-25"
            ],
            "learner_decision_ids": [
              "LD-H24-A25"
            ]
          }
        },
        {
          "seed_id": "SEED-H24-378389D2B0B1FB35",
          "competitor_concept_id": "CONCEPT-H24-378389D2B0B1FB35",
          "competitor_concept": "Systemic epinephrine effect",
          "preferred_label": "Systemic epinephrine effect",
          "competitor_study_unit_id": "SU-A-25",
          "discipline": "MEDICINE",
          "learner_decision_id": "LD-H24-A25",
          "response_class": "PLAUSIBLE_DIAGNOSTIC_ENTITY",
          "competitor_semantic_category": "PLAUSIBLE_DIAGNOSTIC_ENTITY",
          "competitor_decision_granularity": "DIAGNOSIS",
          "option_set_archetype": "DIAGNOSIS_SET",
          "candidate_classification": "COUNTERFACTUAL_CORRECT",
          "relation_ids": [
            "CCR2-H24-378389D2B0B1FB35"
          ],
          "anchor_relation_ids": [
            "AR-H24-378389D2B0B1FB35"
          ],
          "why_plausible_for_this_decision": "SF-H24-A25-01 is a positive shared-decision anchor.",
          "conditions_under_which_competitor_would_be_correct": "Palpitations, tremor, and hypertension immediately after an epinephrine-containing injection without neurologic toxicity.",
          "shared_features_with_key": [
            "SF-H24-A25-01"
          ],
          "candidate_visible_discriminators": [],
          "why_a_partially_knowledgeable_candidate_might_choose_it": "It is a legitimate same-decision alternative in a nearby clinical context.",
          "evidence_refs_for_plausibility": [
            "H24-SEED-MED-LAST-DIFFERENTIAL-01"
          ],
          "evidence_refs_for_discrimination": [
            "H24-SEED-MED-LAST-DIFFERENTIAL-01"
          ],
          "evidence_refs": [
            "H24-SEED-MED-LAST-DIFFERENTIAL-01"
          ],
          "requires_terminal_exclusion_clue": false,
          "strength": "STRONG",
          "onboarding_status": "APPROVED",
          "author_provenance": {
            "author_id": "root-fresh-holdout-author-2026-09-07",
            "proposal_id": "SP-H24-378389D2B0B1FB35",
            "candidate_input_sha256": "9af83bdd1b7f40c53fddd45fb652ca5851c5034d1d0dff90c8f036e69a83adf4"
          },
          "independent_seed_review": {
            "verdict": "APPROVED",
            "review_sha256": "fd21f77d979b24873b1ddbc47013c6149fd1a3cdcfc155a999f133f09a99217a",
            "learner_decision_compatibility": "PASS",
            "response_class_compatibility": "PASS",
            "granularity_compatibility": "PASS",
            "positive_plausibility_support": "PASS",
            "inferior_to_key": "PASS",
            "anchor_positive_for_candidate": "PASS",
            "second_key_safety": "PASS",
            "scope_safety": "PASS",